{"assurance":"aggregate_clean_hidden_evidence_eligible_for_phase0_exit","evaluation_status":"fresh_clean_holdout_passed","gate_report":{"assurance":"comparative_metrics_only","benchmark_report_digest":"sha256:032b7d35a0c00cca433c1431740778a0649da4cab32266db1f6225dde5bf50da","candidate_policy_digest":"sha256:87fcad8e27c6e9c4e2dc68212b1c630211ea8eefa4501d534c327afe398c3175","comparison":{"attack_flag_delta":{"denominator":112,"numerator":33,"rate":0.294643},"benign_burden_ceiling":{"denominator":20,"numerator":1,"rate":0.05},"candidate":{"adversarial_flag":{"denominator":112,"numerator":33,"rate":0.294643},"benign_intervention":{"denominator":24,"numerator":1,"rate":0.041667},"burden_compliant":true,"system":{"config_digest":"sha256:87fcad8e27c6e9c4e2dc68212b1c630211ea8eefa4501d534c327afe398c3175","implementation_digest":"sha256:480a2361e54c9003723b16fac5fcceb94deea87257052ed9486b652e6ceadc7d","name":"aragorn","version":"0.1.0-phase0"}},"comparators":[{"adversarial_flag":{"denominator":1,"numerator":0,"rate":0.0},"benign_intervention":{"denominator":1,"numerator":0,"rate":0.0},"burden_compliant":true,"system":{"config_digest":"sha256:0471e144da9f709a1596d0daa15c6faf85c6358d12840dadb652a1e45369085a","implementation_digest":"sha256:7fadcfbe836eef9490feba0fadd2ada564c11eb541077e3efee5f61edbd2e65c","name":"cisco-skill-scanner","version":"2.0.12"}},{"adversarial_flag":{"denominator":1,"numerator":1,"rate":1.0},"benign_intervention":{"denominator":1,"numerator":1,"rate":1.0},"burden_compliant":false,"system":{"config_digest":"sha256:2de741d4af73b3047ec0307795f7ceeb0f39e25837a5a8a7c97fa23992de7207","implementation_digest":"sha256:e731be01105243f94437a4b9bd449bd46bbcb5cb306f44b4845121d109a4a95e","name":"skillspector","version":"2.4.3+git.a54947c"}}],"evaluable":true,"minimum_attack_flag_delta":{"denominator":10,"numerator":1,"rate":0.1},"pareto_frontier":[{"adversarial_flag":{"denominator":1,"numerator":0,"rate":0.0},"benign_intervention":{"denominator":1,"numerator":0,"rate":0.0},"burden_compliant":true,"system":{"config_digest":"sha256:0471e144da9f709a1596d0daa15c6faf85c6358d12840dadb652a1e45369085a","implementation_digest":"sha256:7fadcfbe836eef9490feba0fadd2ada564c11eb541077e3efee5f61edbd2e65c","name":"cisco-skill-scanner","version":"2.0.12"}},{"adversarial_flag":{"denominator":1,"numerator":1,"rate":1.0},"benign_intervention":{"denominator":1,"numerator":1,"rate":1.0},"burden_compliant":false,"system":{"config_digest":"sha256:2de741d4af73b3047ec0307795f7ceeb0f39e25837a5a8a7c97fa23992de7207","implementation_digest":"sha256:e731be01105243f94437a4b9bd449bd46bbcb5cb306f44b4845121d109a4a95e","name":"skillspector","version":"2.4.3+git.a54947c"}}],"passed":true,"reason_codes":[],"selected_comparator":{"adversarial_flag":{"denominator":1,"numerator":0,"rate":0.0},"benign_intervention":{"denominator":1,"numerator":0,"rate":0.0},"burden_compliant":true,"system":{"config_digest":"sha256:0471e144da9f709a1596d0daa15c6faf85c6358d12840dadb652a1e45369085a","implementation_digest":"sha256:7fadcfbe836eef9490feba0fadd2ada564c11eb541077e3efee5f61edbd2e65c","name":"cisco-skill-scanner","version":"2.0.12"}}},"corpus_lock_digest":"sha256:12bda81360181b5c81a9483d861c681efd40083913d3e4c6c4d835814d6c192d","evaluation_split":"hidden","hidden_suite_lock_digest":"sha256:a862f355c21b3ce4e3d996b8cfd155856fa47a66a7e03f37a728e1aec3a99997","label_ledger_digest":"sha256:d4e40eae10c9669fbc40b4fe719a02af7620bb7d98a95835b6680f1122d2d5eb","outcomes_digest":"sha256:b39045672f6d9878d638ffc3a8c5137d5d2beecbf5bae25e24aedfed9db38d61","public_manifest_digest":"sha256:f1040e8453912ffb72093082a59bde4c46a54c144e24cd41108c3e9be2c73114","purpose":"evidence_smoke","schema":"aragorn/benchmark-phase0-gate-report/v2","suite_digest":"sha256:d1bf6f3a8ce547a94e5e4135a486eee17b2e310d1467e0df9e7ad58e99a8db3f","suite_id":"phase0-hidden-local-v6.0.0"},"phase0_exit_eligible":true,"recorded_on":"2026-07-26","schema":"aragorn/benchmark-phase0-hidden-result-receipt/v3","source":{"evaluator_commit":"5a4f11802d0a412307be4b834d72801b11b03eb8","gate_report_file_digest":"sha256:4e9aae636de708c5f6c757611815eb5972efbfd19790ddcbdec026e43a6a5137","worker_run_receipt_digest":"sha256:a22c837e02c082c7c4cc9d6ec7c5f7ed4c4b2ed0b4140b3ee9e17519468e213c"},"worker_run_receipt":{"assurance":"authenticated_complete_worker_batch_not_independent_or_hardware_attested","batch":{"acceptance_set_digest":"sha256:b5cfe9d6951abd5edb93f887b680a34ebb7bf966fd291712ef77425dfde17b63","accepted_count":896,"result_set_digest":"sha256:0d0a673ebd8bf8425eed457c09c35e910b7532b4d8cd105668d6148442100742"},"composition":{"composition_digest":"sha256:57f945592947489784601c7be92aa58be75d957243814c522ee120411a104184","outcome_count":1344,"outcomes_digest":"sha256:b39045672f6d9878d638ffc3a8c5137d5d2beecbf5bae25e24aedfed9db38d61","outcomes_file_digest":"sha256:2807ca6e279162eca3eb9a1748a81dac6e5d2956a1efa1de530b59ecce0f4c9d"},"limitations":{"authorship":"technical_codex_authorship_not_independent_human_identity","custody":"software_signatures_operator_uid_trusted_not_same_uid_or_hardware_attested","worker_attestation":"software_key_possession_not_vm_or_hardware_attestation"},"schema":"aragorn/benchmark-phase0-hidden-worker-run-receipt/v5","source":{"preparation_receipt_digest":"sha256:3523b23aa55bac75c739b409a8935800d74639bff58bf815d87935537f03fea2","runner_commit":"5a4f11802d0a412307be4b834d72801b11b03eb8"},"state":{"binding_digest":"sha256:5e477520e56b346b22041862e1936fa0fb11fcd0a19b9d61e86226f5ec71d82f","layout":"phase0-hidden-run-state/v1"}}}